name,datepublished ,author,description,gameplatform ,genre,aggregaterating 
Metal Gear Solid V: The Phantom Pain,"Sep 01, 2015","Konami, Kojima Productions","Metal Gear Solid V: The Phantom Pain is the final game in the Metal Gear series. It is the sequel to Metal Gear Solid V: Ground Zeroes released the year before and a prequel to the original Metal Gear. The game has a complex story with long cut-scene sequences, but there are fewer and they are shorter compared to earlier Metal Gear Solid titles. Most of the gameplay mechanics introduced in Ground Zeroes are carried over: it is still an action game and stealth oriented but replaces the linear corridor design from most earlier titles with large open world environments that offer the player unrestricted freedom for the approach. The world has now a real-time day and night cycle and various weather effects that influence enemy behaviour, visibility and sound. Sabotaging or destroying certain structures can also influence other parts of the map.","Windows PC, Xbox 360, PlayStation 4, PlayStation 3, Xbox One","Adventure, Shooter, Tactical",3.8
Half-Life 2,"Nov 16, 2004","Sierra Entertainment, Valve","1998. HALF-LIFE sends a shock through the game industry with its combination of pounding action and continuous, immersive storytelling.
NOW. By taking the suspense, challenge and visceral charge of the original, and adding startling new realism and responsiveness, Half-Life 2 opens the door to a world where the player's presence affects everything around them, from the physical environment to the behaviors even the emotions of both friends and enemies.","Windows PC, Android, Mac, Xbox, Xbox 360, Linux, PlayStation 3",Shooter,4.3
Super Metroid,"Mar 19, 1994","Nintendo R&D1, Nintendo","The Space Pirates, merciless agents of the evil Mother Brain, have stolen the last Metroid from a research station, and once again Mother Brain threatens the safety of the galaxy! Samus Aran must don her awesome array of high-tech weaponry to retrieve the deadly Metroid hidden deep within the cave-riddled planet Zebes. Super Metroid features excellent graphics, with a huge variety of enemies and worlds to explore. The side-view action will be familiar to many players, only now there are new weapons and items, including the Grappling Beam, which allows Samus to swing across large chasms, and the X-Ray Scope, which reveals secret passages.","Wii U, Super Famicom, SNES, Wii, New Nintendo 3DS","Adventure, Platform, Shooter",4.3
Deltarune: Chapter 2,"Sep 17, 2021","8-4, tobyfox","Deltarune: Chapter 2 is the next installment of the sequel to beloved indie darling Undertale...in a different world! This time around, two more classmates join the protagonists in their adventure as they, too, discover a mysterious world hidden behind a door, called the ""Cyber World"".
Players with no save data will be able to start right at Chapter 2. “As long as you generally remember what happened story-wise, you’ll be fine,” the developers said in an FAQ.","Windows PC, Mac, PlayStation 4, Nintendo Switch","Adventure, Indie, RPG, Turn Based Strategy",4.3
Grand Theft Auto: San Andreas,"Oct 26, 2004","TransGaming Inc., Rockstar Games","Returning after his mother's murder to the semi-fictional city of Los Santos (based on Los Angeles), Carl Johnson, a former gang banger, must take back the streets for his family and friends by gaining respect and once again gaining control over the streets. However, a story filled with crime, lies and corruption will lead him to trudge the entire state of San Andreas (based on California and Nevada) to rebuild his life.","Windows PC, Android, Mac, Xbox, Xbox 360, PlayStation 4, iOS, PlayStation 3, PlayStation 2","Adventure, Racing, Shooter",4.1
Mario Kart 8 Deluxe,"Apr 28, 2017","Nintendo of America, Nintendo EPD","Hit the road with the definitive version of Mario Kart 8 and play anytime, anywhere! Race your friends or battle them in a revised battle mode on new and returning battle courses. Play locally in up to 4-player multiplayer in 1080p while playing in TV Mode. Every track from the Wii U version, including DLC, makes a glorious return. Plus, the Inklings appear as all-new guest characters, along with returning favorites, such as King Boo, Dry Bones, and Bowser Jr.!",Nintendo Switch,"Arcade, Racing",4.0
Devil May Cry,"Aug 23, 2001","Capcom Production Studio 4, Capcom","Originally intended to be the fourth installment in the Resident Evil series, Devil May Cry is an action-adventure game that introduced a host of new elements to the gaming community. Chief among them is the Stylish Rank, which grades the player's performance in combat. The game is split into Missions, which are individually scored according to various factors, such as Orbs gathered and damage taken. Additionally, Devil May Cry did away with the pre-rendered backgrounds of prior Resident Evil games in order to allow for a dynamic camera system.",PlayStation 2,Brawler,3.5
Hotline Miami,"Oct 23, 2012","Dennaton Games, Devolver Digital","A top-down slasher/shooter with unlockable gameplay-altering masks and weapons, featuring a neon-flavoured electronic aesthetic, in which a hitman receives anonymous calls ordering him to travel to certain residences and crime dens and massacre those within, as he stumbles through unreal visions and inconsistencies without any answers to how, why or who.","Windows PC, Android, Mac, Linux, PlayStation 4, PlayStation 3, Xbox One, PlayStation Vita, Nintendo Switch, Google Stadia","Arcade, Indie, Shooter",4.0
Fire Emblem Engage,"Jan 20, 2023","Intelligent Systems, Nintendo","Become the Divine Dragon and save the continent of Elyos!
Summon valiant heroes like Marth & Celica alongside a new cast of characters and engage in turn-based, tactical combat against a great evil in this new Fire Emblem story.",Nintendo Switch,"Adventure, RPG, Strategy, Tactical, Turn Based Strategy",3.8
Persona 3 FES,"Apr 19, 2007","Koei, Atlus","Shin Megami Tensei: Persona 3 FES is an add-on disc for Persona 3 containing updates to the original game (referred in the game as ""The Journey""), as well as a new epilogue story, The Answer, in which the player controls Aigis. The subtitle ""Fes"" is derived from the word ""festival"".","PlayStation 3, PlayStation 2","RPG, Simulator, Visual Novel",4.1
Overwatch,"May 24, 2016","Blizzard Entertainment, Square Enix","Join the fight for the future in the world of Overwatch and choose your hero from a diverse cast of soldiers, scientists, adventurers, and oddities. Bend time, defy physics, and unleash a dizzying array of extraordinary powers and weapons. Engage your enemies in iconic locations from around the globe in the ultimate team-based shooter.","Windows PC, PlayStation 4, Xbox One, Nintendo Switch","Shooter, Strategy",3.2
Fire Emblem: Three Houses,"Jul 25, 2019","Intelligent Systems, Nintendo","Here, order is maintained by the Church of Seiros, which hosts the prestigious Officer’s Academy within its headquarters. You are invited to teach one of its three mighty houses, each comprised of students brimming with personality and represented by a royal from one of three territories. As their professor, you must lead your students in their academic lives and in turn-based, tactical RPG battles wrought with strategic, new twists to overcome. Which house, and which path, will you choose?",Nintendo Switch,"Adventure, RPG, Strategy, Tactical, Turn Based Strategy",4.0
13 Sentinels: Aegis Rim,"Nov 28, 2019","Vanillaware, Atlus USA","Uncover the truth and delve into a 2D sidescrolling adventure featuring gorgeous art and environments. Then, battle the kaiju in fast-paced, top-down combat. Customize the Sentinels with an arsenal of mechsuit weaponry, and fight to defend humanity!","PlayStation 4, Nintendo Switch","Adventure, Simulator, Strategy, Tactical",4.3
Batman: Arkham Asylum,"Aug 25, 2009","Eidos Interactive, Rocksteady Studios","Using a great variety of gadgets you must make your way around the island, and the asylums halls to find and stop the joker. The game uses a 3-button combat system, but with a great number of gadget abilites which Batman can unlock. This makes for a very cinematic combat experience when fighting the Joker's goons.","Windows PC, Mac, Xbox 360, PlayStation 3, Ouya","Adventure, Brawler",3.9
Half-Life,"Nov 19, 1998","Valve, Sierra Entertainment","Dr. Gordon Freeman doesn't speak, but he's got a helluva story to tell. This first-person roller-coaster initiated a new era in the history of action games by combining engrossing gameplay, upgraded graphics, ingenious level design and a revolutionary story that may not be all that it seems, told not through cutscenes, but through the visual environment.","Windows PC, Mac, Linux, PlayStation 2","Adventure, Puzzle, Shooter",4.0
Mother 3,"Apr 20, 2006","HAL Laboratory, Nintendo","A turn-based JRPG and sequel to EarthBound (1994) in which a tragedy surrounding a family in the primitive yet joyful village of Tazmily incites the coming-of-age story of Lucas, the family's younger son, who goes on perilous adventures along with his friends in order to find his missing brother and stop a group of masked men from bringing about the end of the world.","Wii U, Game Boy Advance","RPG, Turn Based Strategy",4.5
Super Mario Sunshine,"Jul 19, 2002","Nintendo EAD, Nintendo","Super Mario Sunshine is a Mario action-adventure 3D platformer. It follows Super Mario 64, and is the second 3D Mario platformer. Gameplay features a combination of action and puzzle solving, with numerous stages and multiple episodes to each stage, and plenty of hidden secrets and surprises. This game introduced many recurring characters and bosses in the Mario series, including Toadsworth, Bowser Jr., Petey Piranha, Gooper Blooper, Piantas, Nokis, Shadow Mario, and F.L.U.D.D. Super Mario Sunshine pays homage to Mario's Italian heritage and upbringing, with many of the locations in the game having Italian names and sometimes referencing Italian culture.",Nintendo GameCube,"Adventure, Platform",3.7
Pokémon Violet,"Nov 18, 2022","Game Freak, Nintendo","The Pokémon Scarlet and Pokémon Violet games, the newest chapters in the Pokémon series, are coming to Nintendo Switch later this year. With these new titles, the Pokémon series takes a new evolutionary step, allowing you to explore freely in a richly expressed open world.
Various towns blend seamlessly into the wilderness with no borders. You’ll be able to see the Pokémon of this region in the skies, in the seas, in the forests, on the streets—all over! You’ll be able to experience the true joy of the Pokémon series—battling against wild Pokémon in order to catch them—now in an open-world game that players of any age can enjoy.​",Nintendo Switch,"Adventure, RPG, Turn Based Strategy",3.5
Xenoblade Chronicles: Definitive Edition,"May 29, 2020","Nintendo, Monolith Soft","Discover the origins of Shulk as he and his companions clash against a seemingly-unstoppable mechanical menace. Wield a future-seeing blade, chain together attacks, and carefully position your party members in strategic, real-time combat as you journey across a massive world.",Nintendo Switch,RPG,4.3
Left 4 Dead 2,"Nov 17, 2009","Turtle Rock Studios, Valve","Left 4 Dead 2 is a cooperative first-person shooter video game, the sequel to Valve Corporation's Left 4 Dead. The Game builds upon cooperatively focused gameplay and Valve's proprietary Source engine, the same game engine used in the original Left 4 Dead. Set during the aftermath of an apocalyptic pandemic, Left 4 Dead 2 focuses on four new Survivors, fighting against hordes of the Infected, who develop severe psychosis and exhibit zombie-like tendencies. The Survivors must fight their way through five campaigns, interspersed with safe houses that act as checkpoints, with the goal of escape at each campaign's finale.","Windows PC, Mac, Xbox 360, Linux",Shooter,3.9
Batman: Arkham City,"Oct 18, 2011","DC Entertainment, Rocksteady Studios","After the events of Batman: Arkham Asylum (2009), a section of the city of Gotham has been turned into a prison, designed to keep the scum of the city away from the people. Bruce Wayne protests this prison but is shortly kidnapped by the despicable Hugo Strange, thus having to face the city's most powerful villains as the Batman while trying to uncover Strange's plans.","Windows PC, Xbox 360, PlayStation 3, OnLive Game System","Adventure, Brawler",4.1
Psychonauts 2,"Aug 24, 2021","Xbox Game Studios, Double Fine Productions","Psychonauts 2 is a mind-bending trip through the strange worlds hiding inside our brains. Freshly-minted special agent and acrobat extraordinaire Razputin “Raz” Aquato returns to unpack emotional baggage and expand mental horizons. Along the way he’ll help new friends, like this magical mote of light voiced (and sung) by Jack Black. Raz must use his powers to unravel dark mysteries about the Psychonauts team and his own family origins.","Windows PC, Mac, Linux, PlayStation 4, Xbox One, Xbox Series","Adventure, Platform",4.2
Horizon Zero Dawn,"Feb 28, 2017","Guerrilla Games, Sony Interactive Entertainment","Welcome to a vibrant world rich with the beauty of nature – but inhabited by awe-inspiring, highly advanced machines. As a young machine hunter named Aloy, you must unravel the mysteries of this world and find your own destiny.","Windows PC, PlayStation 4","Adventure, RPG, Shooter",3.6
League of Legends,"Oct 27, 2009","GOA Games Services Ltd., Riot Games","League of Legends is a fast-paced, competitive online game that blends the speed and intensity of an RTS with RPG elements. Two teams of powerful champions, each with a unique design and playstyle, battle head-to-head across multiple battlefields and game modes. With an ever-expanding roster of champions, frequent updates and a thriving tournament scene, League of Legends offers endless replayability for players of every skill level.","Windows PC, Mac","MOBA, RPG, Strategy",2.1
Control,"Aug 27, 2019","505 Games, Remedy Entertainment","Control is a supernatural 3rd person action-adventure will challenge you to master the combination of supernatural abilities, modifiable loadouts and reactive environments while fighting through a deep and unpredictable world.","Windows PC, PlayStation 4, Xbox One, PlayStation 5, Nintendo Switch, Google Stadia, Xbox Series","Adventure, Shooter",3.6
Marvel's Guardians of the Galaxy,"Oct 26, 2021","Square Enix, Eidos Montréal","Fire up a wild ride across the cosmos with a fresh take on Marvel’s Guardians of the Galaxy. In this action-adventure game, you are Star-Lord leading the unpredictable Guardians from one explosion of chaos to the next. You got this. Probably.","Windows PC, PlayStation 4, Xbox One, PlayStation 5, Xbox Series","Adventure, RPG, Shooter",3.8
Yakuza Kiwami,"Jan 21, 2016","Sega Games, Ryū Ga Gotoku Studios",Yakuza Kiwami is a remake of the 2005 open world action-adventure game Yakuza.,"Windows PC, PlayStation 4, PlayStation 3, Xbox One","Adventure, Brawler, RPG",3.7
Danganronpa: Trigger Happy Havoc,"Nov 25, 2010","Spike ChunSoft, NIS America","In ""Danganronpa"" you'll dive into a series of class trials and expose the lies and contradictions of your classmates in order to find out who's behind each grisly murder. In each trial, you'll have to use the evidence and testimony collected during your investigation to literally shoot down your opponent's assertions. By combining logic and motion, ""Danganronpa"" offers an exciting and unprecedented gaming experience.","Windows PC, Android, Mac, Linux, iOS, PlayStation Vita, PlayStation Portable","Adventure, Point-and-Click, Visual Novel",3.5
Halo Infinite,"Nov 15, 2021","Xbox Game Studios, 343 Industries","The Master Chief returns in Halo Infinite – the next chapter of the legendary franchise. When all hope is lost and humanity’s fate hangs in the balance, the Master Chief is ready to confront the most ruthless foe he’s ever faced. Step inside the armor of humanity’s greatest hero to experience an epic adventure and explore the massive scale of the Halo ring.","Windows PC, Xbox One, Xbox Series","Adventure, Shooter",3.3
Cult of the Lamb,"Aug 11, 2022","Devolver Digital, Massive Monster","Cult of the Lamb casts players in the role of a possessed lamb saved from annihilation by an ominous stranger, and must repay their debt by building a loyal following in his name. Start your own cult in a land of false prophets, venturing out into diverse and mysterious regions to build a loyal community of woodland worshippers and spread your Word to become the one true cult.","Windows PC, Mac, PlayStation 4, Xbox One, PlayStation 5, Nintendo Switch, Xbox Series","Adventure, Brawler, Indie, RPG, Simulator, Strategy",3.6
MultiVersus,"Jul 19, 2022","Player First Games, WB Games","MultiVersus is a platform fighter that lets you team up with or against your friends using some of the world’s most iconic characters including Batman, Shaggy, Superman, Bugs Bunny & more. Use unique co-op abilities, find your favorite fighter combos and save the Multiverse!","Windows PC, PlayStation 4, Xbox One, PlayStation 5, Xbox Series",Fighting,2.7
Sonic Mania,"Aug 15, 2017","PagodaWest Games, Sega",Experience the ultimate celebration of past and future in Sonic Mania! Re-live the Sonic of the past with an exciting new twist on classic zones while fighting against new bosses and Dr. Eggman’s evil robot army. Go head to-head with players in Competition Mode or play in Co-Op Mode with a friend.,"Windows PC, PlayStation 4, Xbox One, Nintendo Switch","Adventure, Platform",4.0
Team Fortress 2,"Oct 09, 2007","Electronic Arts, Valve","One of the most popular online action games of all time, Team Fortress 2 delivers constant free updates—new game modes, maps, equipment and, most importantly, hats. Nine distinct classes provide a broad range of tactical abilities and personalities, and lend themselves to a variety of player skills.","Windows PC, Mac, Xbox 360, Linux, PlayStation 3",Shooter,3.9
Hogwarts Legacy,"Feb 10, 2023","Portkey Games, Avalanche Software","Hogwarts Legacy is an immersive, open-world action RPG set in the world first introduced in the Harry Potter books. Now you can take control of the action and be at the center of your own adventure in the wizarding world. Embark on a journey through familiar and new locations as you explore and discover fantastic beasts, customize your character and craft potions, master spell casting, upgrade talents, and become the wizard you want to be. Discover the feeling of living at Hogwarts as you make allies, battle Dark wizards, and ultimately decide the fate of the wizarding world. Your legacy is what you make of it.","Windows PC, PlayStation 4, Xbox One, PlayStation 5, Nintendo Switch, Xbox Series","Adventure, RPG",3.4
Doki Doki Literature Club!,"Sep 22, 2017",Team Salvato,The Literature Club is full of cute girls! Will you write the way into their heart? This game is not suitable for children or those who are easily disturbed.,"Windows PC, Mac, Linux","Adventure, Indie, Visual Novel",3.3
Resident Evil 3,"Apr 03, 2020","K2, Capcom","Resident Evil 3 is a remake of the original Resident Evil 3: Nemesis released in 1999. It updates the story and gameplay for a modern audience. Like the Resident Evil 2 remake, the game uses over-the-shoulder third person point of view similar to Resident Evil 4 and later installments. Players will spend most of their time playing as Jill Valentine, although on some occasions they will assume the role of Carlos Oliveira, giving him more screen time as a deuteragonist.","Windows PC, PlayStation 4, Xbox One, PlayStation 5, Xbox Series","Adventure, Shooter",3.2
The Legend of Zelda: A Link to the Past,"Nov 21, 1991","Nintendo, Nintendo EAD","The Legend of Zelda: A Link to the Past is a top-down action game with puzzle-solving elements similar to the original The Legend of Zelda. After the side-scrolling and RPG-like gameplay of Zelda II: The Adventure of Link, the game is a return to the top-down view and gameplay style of the first installment. It introduces major new items to the series such as the Master Sword and the concept of two different worlds, which was revisited to some extent in Ocarina of Time with two distinct time periods rather than dark and light worlds.","Wii U, Super Famicom, SNES, Wii, New Nintendo 3DS, Satellaview","Adventure, Puzzle",4.1
Xenoblade Chronicles 2,"Dec 01, 2017","Monolith Soft, Nintendo","The next adventure is on the Nintendo Switch console set on the backs of colossal, living Titans. Discover each Titan's diverse regions, culture, wildlife, equipment, and hidden secrets. Find, bond with, and command weaponized life forms known as Blades to earn abilities and enhance them. Uncover the history of Alrest and the mystery of its endless ocean of clouds.",Nintendo Switch,"Adventure, RPG",3.9
Katana Zero,"Apr 18, 2019","Askiisoft, Devolver Digital","Katana Zero is a fast paced neo-noir action platformer, focusing on tight, instant-death acrobatic combat, and a dark 80's neon aesthetic. Aided with your trusty katana, the time manipulation drug Chronos and the rest of your assassin's arsenal, fight your way through a fractured city, and take back what's rightfully yours.","Windows PC, Mac, Xbox One, Nintendo Switch","Adventure, Arcade, Indie, Platform, Strategy",4.1
Phoenix Wright: Ace Attorney,"Sep 15, 2005","Nintendo Australia, Capcom","Meet Phoenix Wright, the rookie defense lawyer new to the scene with the wildest cross-examination skills in town! Take on five intriguing cases to reveal dramatic, stunning, and even comical court proceedings. Use both the touch screen to investigate the crime scenes, question witnesses and present shocking evidence. “Objection!”...It’s outrageous fun! You won’t be able to put down this laugh-out-loud, riveting adventure!",Nintendo DS,"Adventure, Point-and-Click, Puzzle, Visual Novel",4.1
Silent Hill,"Feb 23, 1999","Konami, Team Silent","Silent Hill is the first installment in the Silent Hill series of psychological survival horror video games. Unlike earlier survival horror games that focused on protagonists with combat training, the main character Harry Mason is an average man. The gameplay consists of combat, exploration, and puzzle-solving. The controller vibration is used to indicate Harry's heartbeat and will vibrate on low health. The player must regularly enter an inventory screen to check Harry's health, use items, and equip different weapons.","PlayStation 3, PlayStation, PlayStation Vita, PlayStation Portable","Adventure, Puzzle",4.1
Shadow of the Colossus,"Oct 18, 2005","Sony Computer Entertainment, Team Ico","An open-world action/adventure game in which a young wanderer, along with a stolen magical sword and his steed companion, trespasses a cursed land, makes a deal with an ancient being to bring a sacrificial victim back to life, and sets off to fulfill his end of the bargain, which involves tracking down and infiltrating the abodes of sixteen colossi and sacrificing them to achieve his goal.",PlayStation 2,"Adventure, Platform, Puzzle",4.4
Life is Strange,"Jan 29, 2015","Feral Interactive, DON'T NOD","Life is Strange is a five part episodic game that sets out to revolutionize story based choice and consequence games by allowing the player to rewind time and affect the past, present and future.","Windows PC, Android, Mac, Xbox 360, Linux, PlayStation 4, iOS, PlayStation 3, Xbox One","Adventure, Puzzle, RPG",3.5
Chrome Dino,"Sep 01, 2014",Google,"Chrome Dino is a game easter egg in Google's Chrome web browser. It can be played by touching over the dinosaur or pressing the space bar when your internet connection goes down or by accessing chrome://dino/ on the web browser.
The game is an endless runner. The objective is to jump over cacti an avoid pterodactyls flying in your direction.",Web browser,Arcade,3.5
Fallout 4,"Nov 09, 2015","Bethesda Game Studios, Bethesda Softworks","Bethesda Game Studios welcome you to the world of Fallout 4, their most ambitious game ever, and the next generation of open-world gaming. As the sole survivor of Vault 111, you enter a world destroyed by nuclear war. Every second is a fight for survival, and every choice is yours. Only you can rebuild and determine the fate of the Wasteland. Welcome home.","Windows PC, PlayStation 4, Xbox One, PlayStation 5, Xbox Series","RPG, Shooter",3.2
Dark Souls II: Scholar of the First Sin,"Apr 02, 2015","Bandai Namco Entertainment, FromSoftware","'Dark Souls II: Scholar of the First Sin' is an upgrade and bundle of Dark Souls II that brings the game to Playstation 4 and Xbox One, as well as DX11 features on PC. It also bundles all previous DLCs and provides additional features and content.","Windows PC, Xbox 360, PlayStation 4, PlayStation 3, Xbox One","Adventure, RPG",3.5
Uncharted 4: A Thief's End,"May 10, 2016","Naughty Dog, Sony Interactive Entertainment","Several years after his last adventure, retired fortune hunter, Nathan Drake, is forced back into the world of thieves. With the stakes much more personal, Drake embarks on a globe-trotting journey in pursuit of a historical conspiracy behind a fabled pirate treasure. His greatest adventure will test his physical limits, his resolve, and ultimately what he's willing to sacrifice to save the ones he loves.",PlayStation 4,"Adventure, Shooter",4.1
